{
  "CPUrequirements": {
    "platformType": "x86",
    "socket": [
      {
        "coreNumbers": 1
      }
    ]
  },
  "ephemeral-file-system-size": 0,
  "name": "firewall",
  "functional-capability": "firewall_docker",
  "memory-size": 2048,
  "vnf-type": "docker",
  "uri-yang": "http://130.192.225.179:8081/yang/fw_cfg/",
  "uri-image-type": "docker-registry",
  "swap-disk-size": 0,
  "expandable": false,
  "ports": [
    {
      "name": "eth",
      "min": "1",
      "label": "management",
      "ipv4-config": "none",
      "position": "0-0",
      "ipv6-config": "none"
    },
    {
      "name": "eth",
      "min": "1",
      "label": "L2Port",
      "ipv4-config": "none",
      "position": "1-N",
      "ipv6-config": "none"
    }
  ],
  "root-file-system-size": 40,
  "uri-image": "firewall_config"
}
